{
  "id": "PLAN-4",
  "title": "Implementation Plan: FEAT-2 — GDPR & Privacy Compliance",
  "requirements": "docs/requirements/FEAT-2.md",
  "status": "completed",
  "created": "2026-04-09",
  "lastUpdated": "2026-04-27",
  "decisions": [
    {
      "decision": "Decisione",
      "choice": "Scelta",
      "date": "Data"
    }
  ],
  "stories": [
    {
      "id": "US-001",
      "description": "Pagina Privacy Policy",
      "tasks": "T-01, T-02",
      "status": "completed"
    },
    {
      "id": "US-002",
      "description": "Pagina Terms of Service",
      "tasks": "T-01, T-02",
      "status": "completed"
    },
    {
      "id": "US-003",
      "description": "Consenso alla registrazione",
      "tasks": "T-03, T-04, T-05",
      "status": " Done"
    },
    {
      "id": "US-004",
      "description": "Export dati personali",
      "tasks": "T-08, T-09",
      "status": " Done"
    },
    {
      "id": "US-005",
      "description": "Hard delete account",
      "tasks": "T-06, T-07",
      "status": " Done"
    },
    {
      "id": "US-006",
      "description": "Purge automatico utenti soft-deleted",
      "tasks": "T-10, T-11",
      "status": " Done"
    },
    {
      "id": "US-007",
      "description": "Cleanup refresh token scaduti",
      "tasks": "T-10, T-11",
      "status": " Done"
    },
    {
      "id": "US-008",
      "description": "Retention e cleanup audit log",
      "tasks": "T-10, T-11",
      "status": " Done"
    }
  ],
  "tasks": [
    {
      "id": "T-01",
      "stories": [
        "US-001",
        "US-002"
      ],
      "size": "Small",
      "status": "completed",
      "dependsOn": [],
      "whatToDo": "Creare due componenti Angular standalone per le pagine Privacy Policy e Terms of Service. Aggiungere le route `/privacy-policy` e `/terms-of-service` in `app.routes.ts` (accessibili senza guard). Il contenuto sarà placeholder testuale che il titolare del trattamento personalizzerà.",
      "definitionOfDone": [
        {
          "description": "Componente `PrivacyPolicy` in `projects/app/src/app/pages/privacy-policy/`",
          "completed": true
        }
      ],
      "decision": null,
      "notes": "Componenti standalone con `templateUrl` e `styleUrl`, lazy-loaded via `loadComponent` nelle route"
    },
    {
      "id": "T-02",
      "stories": [
        "US-001",
        "US-002"
      ],
      "size": "Small",
      "status": "completed",
      "dependsOn": [],
      "whatToDo": "Creare un componente footer (`AppFooter`) da inserire nel template principale (`app.html`, dopo `<router-outlet />`). Il footer contiene link a Privacy Policy e Terms of Service. Stile minimale, coerente con il design Material.",
      "definitionOfDone": [
        {
          "description": "Componente `AppFooter` creato in `projects/app/src/app/footer/`",
          "completed": true
        }
      ],
      "decision": null,
      "notes": "Componente standalone con `templateUrl`/`styleUrl` separati, coerente con il pattern degli altri componenti dell'app"
    },
    {
      "id": "T-03",
      "stories": [
        "US-003"
      ],
      "size": "Small",
      "status": "completed",
      "dependsOn": [],
      "whatToDo": "Aggiungere i campi di consenso all'entità `ApplicationUser`: `PrivacyPolicyAcceptedAt` (DateTime?), `TermsAcceptedAt` (DateTime?), `ConsentVersion` (string?). Aggiornare la configurazione EF (`ApplicationUserConfiguration`). Creare la migration EF Core.",
      "definitionOfDone": [
        {
          "description": "Campi `PrivacyPolicyAcceptedAt`, `TermsAcceptedAt`, `ConsentVersion` aggiunti a `ApplicationUser`",
          "completed": true
        }
      ],
      "decision": null,
      "notes": "Campi posizionati prima di `RefreshTokens` in `ApplicationUser`, raggruppando i campi di consenso insieme"
    },
    {
      "id": "T-04",
      "stories": [
        "US-003"
      ],
      "size": "Medium",
      "status": "completed",
      "dependsOn": [
        "T-03"
      ],
      "whatToDo": "Modificare `RegisterCommand` per includere `AcceptPrivacyPolicy` (bool) e `AcceptTermsOfService` (bool). Aggiungere validazione in `RegisterCommandValidator` (entrambi devono essere `true`). Aggiornare `RegisterCommandHandler` per salvare i timestamp di consenso e la `ConsentVersion` corrente sull'utente creato. Definire la versione corrente del consenso come configurazione in `appsettings.json` (es. `Privacy:ConsentVersion`). Aggiungere audit log per l'evento di consenso.",
      "definitionOfDone": [
        {
          "description": "`RegisterCommand` include `AcceptPrivacyPolicy` e `AcceptTermsOfService`",
          "completed": true
        }
      ],
      "decision": null,
      "notes": "I timestamp di consenso vengono impostati sull'oggetto `ApplicationUser` prima di `CreateAsync`, salvati atomicamente con la creazione utente"
    },
    {
      "id": "T-05",
      "stories": [
        "US-003"
      ],
      "size": "Small",
      "status": "completed",
      "dependsOn": [
        "T-04"
      ],
      "whatToDo": "Aggiungere checkbox di consenso al form di registrazione (`register.ts` / `register.html`). La checkbox include link alla Privacy Policy e ai Terms of Service. Il form non è inviabile senza la checkbox selezionata. Aggiornare la chiamata API per includere i campi di consenso.",
      "definitionOfDone": [
        {
          "description": "Checkbox con link a Privacy Policy e Terms of Service aggiunta al form di registrazione",
          "completed": true
        }
      ],
      "decision": null,
      "notes": "Una sola checkbox copre entrambi i consensi (privacy + terms) — il testo include link a entrambi i documenti per semplificare la UX"
    },
    {
      "id": "T-06",
      "stories": [
        "US-005"
      ],
      "size": "Medium",
      "status": "completed",
      "dependsOn": [],
      "whatToDo": "Modificare `DeleteAccountCommandHandler` per eseguire hard delete anziché soft delete. Il flusso diventa: verificare password → anonimizzare audit log dell'utente (set `UserId = null`, rimuovere PII dal campo `Details`) → eliminare refresh token → eliminare il record utente dal DB (via `UserManager.DeleteAsync`). Creare un servizio `IUserPurgeService` in Application con interfaccia, implementazione in Infrastructure, per riutilizzare la logica in US-006.",
      "definitionOfDone": [
        {
          "description": "Interfaccia `IUserPurgeService` in `Application/Common/Interfaces/` con metodo `PurgeUserAsync(Guid userId)`",
          "completed": true
        }
      ],
      "decision": null,
      "notes": null
    },
    {
      "id": "T-07",
      "stories": [
        "US-005"
      ],
      "size": "Small",
      "status": "completed",
      "dependsOn": [
        "T-06"
      ],
      "whatToDo": "Aggiornare il dialog di conferma cancellazione nella pagina profilo per informare l'utente che la cancellazione è definitiva e irreversibile. Aggiungere testo esplicativo che i dati verranno eliminati permanentemente.",
      "definitionOfDone": [
        {
          "description": "Testo dialog aggiornato: menzione esplicita che la cancellazione è permanente e i dati saranno eliminati",
          "completed": true
        }
      ],
      "decision": null,
      "notes": null
    },
    {
      "id": "T-08",
      "stories": [
        "US-004"
      ],
      "size": "Medium",
      "status": "completed",
      "dependsOn": [],
      "whatToDo": "Creare query MediatR `ExportMyDataQuery` che raccoglie tutti i dati dell'utente autenticato: profilo (nome, cognome, email, date, consensi, ruoli), audit log relativo all'utente. Endpoint `GET /api/v1/auth/export-my-data` protetto da `[Authorize]`. La risposta è JSON. L'audit log registra la richiesta di export.",
      "definitionOfDone": [
        {
          "description": "`ExportMyDataQuery` e `ExportMyDataQueryHandler` in `Application/Auth/Queries/ExportMyData/`",
          "completed": true
        }
      ],
      "decision": null,
      "notes": "Usato `.ToList()` sincronamente per la query audit log perché il layer Application non referenzia `Microsoft.EntityFrameworkCore` (Clean Architecture), coerente con gli altri handler (`GetAuditLogEntriesQueryHandler`, `ExportAuditLogQueryHandler`)"
    },
    {
      "id": "T-09",
      "stories": [
        "US-004"
      ],
      "size": "Small",
      "status": "completed",
      "dependsOn": [
        "T-08"
      ],
      "whatToDo": "Aggiungere pulsante \"Esporta i miei dati\" nella pagina profilo. Al click, chiama l'endpoint e scarica il JSON come file. Usare `Blob` + `URL.createObjectURL` per il download.",
      "definitionOfDone": [
        {
          "description": "Pulsante \"Export My Data\" aggiunto in `profile.html` (prima del pulsante Delete Account)",
          "completed": true
        }
      ],
      "decision": null,
      "notes": "Download via `Blob` + `URL.createObjectURL` + anchor click programmatico — pattern standard senza dipendenze esterne"
    },
    {
      "id": "T-10",
      "stories": [
        "US-006",
        "US-007",
        "US-008"
      ],
      "size": "Medium",
      "status": "completed",
      "dependsOn": [
        "T-06 (riutilizza `IUserPurgeService`)"
      ],
      "whatToDo": "Creare la sezione di configurazione `DataRetention` in `appsettings.json` con i periodi di retention e gli intervalli di esecuzione. Creare un servizio `IDataCleanupService` con metodi per: purge utenti soft-deleted, cleanup refresh token, cleanup audit log. Implementazione in Infrastructure che usa `ApplicationDbContext` direttamente per le query bulk delete.",
      "definitionOfDone": [
        {
          "description": "Sezione `DataRetention` in `appsettings.json` con i 4 valori configurabili (`SoftDeletedUserRetentionDays`: 30, `RefreshTokenRetentionDays`: 7, `AuditLogRetentionDays`: 365, `CleanupIntervalHours`: 24)",
          "completed": true
        }
      ],
      "decision": null,